<?xml version="1.0"?>
<!DOCTYPE program SYSTEM "Kid.dtd">
<program>
<statement_list>
<statement>
<if_statement>
<condition>
<expression>
<term>
<factor>
<var>
<identifier>x</identifier>
</var>
</factor>
</term>
</expression>
<rel_op>&gt;</rel_op>
<expression>
<term>
<factor>
<number>0</number>
</factor>
</term>
</expression>
</condition>
<statement>
<block>
<statement_list>
<statement>
<assignment>
<var>
<identifier>x</identifier>
</var>
<expression>
<term>
<factor>
<var>
<identifier>x</identifier>
</var>
</factor>
</term>
<op>+</op>
<term>
<factor>
<number>2</number>
</factor>
</term>
</expression>
</assignment>
</statement>
<statement>
<if_statement>
<condition>
<expression>
<term>
<factor>
<var>
<identifier>x</identifier>
</var>
</factor>
</term>
</expression>
<rel_op>&lt;=</rel_op>
<expression>
<term>
<factor>
<var>
<identifier>y</identifier>
</var>
</factor>
</term>
</expression>
</condition>
<statement>
<block>
<statement_list>
<statement>
<assignment>
<var>
<identifier>y</identifier>
</var>
<expression>
<term>
<factor>
<var>
<identifier>x</identifier>
</var>
</factor>
</term>
</expression>
</assignment>
</statement>
</statement_list>
</block>
</statement>
</if_statement>
</statement>
</statement_list>
</block>
</statement>
</if_statement>
</statement>
</statement_list>
</program>
